{
  "dataset_name": "HISEDU - Lịch sử 8 Kết nối tri thức - Hỏi đáp RAG",
  "version": "1.0.0",
  "id": "Q_HIST8_LS_06_CAU_HOI_CB_29",
  "chunk_id": "CHK_HIST8_LS_06_CAU_HOI_CB_29",
  "title": "xiem-thuc-hien-nhung-cai-cach-nao-vao-nua-the-ki-xix",
  "question": "Xiêm thực hiện những cải cách nào vào nửa sau thế kỉ XIX?",
  "answer": "Dưới Rama IV và Rama V, Xiêm cải tổ hành chính, pháp luật, thuế, quân đội và giáo dục; bãi bỏ dần chế độ nô lệ, phát triển giao thông–thương mại, thuê chuyên gia nước ngoài và ngoại giao cân bằng Anh–Pháp.",
  "answer_type": "textbook_factual",
  "difficulty": "basic",
  "chapter": {
    "id": "HIST8_KNTT_CH06",
    "folder": "chapter_06",
    "title": "Châu Á từ nửa sau thế kỉ XIX đến đầu thế kỉ XX"
  },
  "lesson": {
    "id": "HIST8_KNTT_B15",
    "folder": "lesson_15",
    "title": "Ấn Độ và Đông Nam Á từ nửa sau thế kỉ XIX đến đầu thế kỉ XX"
  },
  "keywords": [
    "Ấn Độ và Đông Nam Á từ nửa sau thế kỉ XIX đến đầu thế kỉ XX",
    "Xiêm",
    "thực",
    "cải",
    "cách",
    "nửa",
    "XIX"
  ],
  "source": {
    "name": "SGK Lịch sử và Địa lí 8 - Kết nối tri thức với cuộc sống (Phần Lịch sử)",
    "url": "https://hanhtrangso.nxbgd.vn/",
    "locator": "Bài 15: Ấn Độ và Đông Nam Á từ nửa sau thế kỉ XIX đến đầu thế kỉ XX",
    "page_number": null
  },
  "review_status": "Đã kiểm tra cấu trúc và đối chiếu sơ bộ; chờ giáo viên duyệt",
  "provenance_note": "Câu trả lời được diễn đạt lại, tổng hợp theo bài học; không phải trích dẫn nguyên văn SGK.",
  "paired_question_file": "question_013.txt"
}
