{
  "dataset_name": "HISEDU - Lịch sử 8 Kết nối tri thức - Hỏi đáp RAG",
  "version": "1.0.0",
  "id": "Q_HIST8_LS_04_CAU_HOI_CB_12",
  "chunk_id": "CHK_HIST8_LS_04_CAU_HOI_CB_12",
  "title": "cac-mac-va-phri-drich-ang-ghen-co-vai-tro-gi-doi-voi-su-doi-cua",
  "question": "Các Mác và Phri-đrích Ăng-ghen có vai trò gì đối với sự ra đời của chủ nghĩa xã hội khoa học?",
  "answer": "Marx và Engels kế thừa có phê phán các tư tưởng trước, phân tích quy luật xã hội tư bản, xây dựng lí luận về sứ mệnh lịch sử của giai cấp công nhân và trực tiếp tổ chức phong trào quốc tế.",
  "answer_type": "textbook_factual",
  "difficulty": "basic",
  "chapter": {
    "id": "HIST8_KNTT_CH04",
    "folder": "chapter_04",
    "title": "Châu Âu và nước Mỹ từ cuối thế kỉ XVIII đến đầu thế kỉ XX"
  },
  "lesson": {
    "id": "HIST8_KNTT_B11",
    "folder": "lesson_11",
    "title": "Phong trào công nhân từ cuối thế kỉ XVIII đến đầu thế kỉ XX và sự ra đời của chủ nghĩa xã hội khoa học"
  },
  "keywords": [
    "Phong trào công nhân từ cuối thế kỉ XVIII đến đầu thế kỉ XX và sự ra đời của chủ nghĩa xã hội khoa học",
    "Mác",
    "Phri-đrích",
    "Ăng-ghen",
    "vai",
    "trò",
    "đời",
    "nghĩa",
    "hội",
    "khoa",
    "học"
  ],
  "source": {
    "name": "SGK Lịch sử và Địa lí 8 - Kết nối tri thức với cuộc sống (Phần Lịch sử)",
    "url": "https://hanhtrangso.nxbgd.vn/",
    "locator": "Bài 11: Phong trào công nhân từ cuối thế kỉ XVIII đến đầu thế kỉ XX và sự ra đời của chủ nghĩa xã hội khoa học",
    "page_number": null
  },
  "review_status": "Đã kiểm tra cấu trúc và đối chiếu sơ bộ; chờ giáo viên duyệt",
  "provenance_note": "Câu trả lời được diễn đạt lại, tổng hợp theo bài học; không phải trích dẫn nguyên văn SGK.",
  "paired_question_file": "question_004.txt"
}
