{
  "dataset_name": "HISEDU - Lịch sử 8 Kết nối tri thức - Hỏi đáp RAG",
  "version": "1.0.0",
  "id": "Q_HIST8_LS_04_CAU_HOI_CB_27",
  "chunk_id": "CHK_HIST8_LS_04_CAU_HOI_CB_27",
  "title": "cach-mang-thang-hai-nam-1917-o-nga-dat-ket-qua-gi",
  "question": "Cách mạng tháng Hai năm 1917 ở Nga đạt kết quả gì?",
  "answer": "Cách mạng tháng Hai lật đổ chế độ Nga hoàng và đưa Nga thành nước cộng hòa. Tuy nhiên xuất hiện cục diện hai chính quyền: Chính phủ lâm thời tư sản và các Xô viết công nhân, nông dân, binh lính.",
  "answer_type": "textbook_factual",
  "difficulty": "basic",
  "chapter": {
    "id": "HIST8_KNTT_CH04",
    "folder": "chapter_04",
    "title": "Châu Âu và nước Mỹ từ cuối thế kỉ XVIII đến đầu thế kỉ XX"
  },
  "lesson": {
    "id": "HIST8_KNTT_B12",
    "folder": "lesson_12",
    "title": "Chiến tranh thế giới thứ nhất (1914 - 1918) và Cách mạng tháng Mười Nga năm 1917"
  },
  "keywords": [
    "Chiến tranh thế giới thứ nhất (1914 - 1918) và Cách mạng tháng Mười Nga năm 1917",
    "Cách",
    "mạng",
    "Hai",
    "1917",
    "Nga",
    "đạt",
    "kết",
    "quả"
  ],
  "source": {
    "name": "SGK Lịch sử và Địa lí 8 - Kết nối tri thức với cuộc sống (Phần Lịch sử)",
    "url": "https://hanhtrangso.nxbgd.vn/",
    "locator": "Bài 12: Chiến tranh thế giới thứ nhất (1914 - 1918) và Cách mạng tháng Mười Nga năm 1917",
    "page_number": null
  },
  "review_status": "Đã kiểm tra cấu trúc và đối chiếu sơ bộ; chờ giáo viên duyệt",
  "provenance_note": "Câu trả lời được diễn đạt lại, tổng hợp theo bài học; không phải trích dẫn nguyên văn SGK.",
  "paired_question_file": "question_009.txt"
}
