{
  "dataset_name": "HISEDU - Lịch sử 8 Kết nối tri thức - Hỏi đáp RAG",
  "version": "1.0.0",
  "id": "Q_HIST8_LS_04_CAU_HOI_CB_18",
  "chunk_id": "CHK_HIST8_LS_04_CAU_HOI_CB_18",
  "title": "phong-trao-cong-nhan-cuoi-the-ki-xix-dau-the-ki-xx-gan-voi-su-doi",
  "question": "Phong trào công nhân cuối thế kỉ XIX đầu thế kỉ XX gắn với sự ra đời của ngày Quốc tế Lao động như thế nào?",
  "answer": "Cuộc đấu tranh ngày 1/5/1886 của công nhân Chicago đòi ngày làm tám giờ trở thành biểu tượng quốc tế. Năm 1889, Quốc tế thứ hai quyết định lấy ngày 1/5 hằng năm làm ngày đoàn kết và đấu tranh của công nhân thế giới.",
  "answer_type": "textbook_factual",
  "difficulty": "basic",
  "chapter": {
    "id": "HIST8_KNTT_CH04",
    "folder": "chapter_04",
    "title": "Châu Âu và nước Mỹ từ cuối thế kỉ XVIII đến đầu thế kỉ XX"
  },
  "lesson": {
    "id": "HIST8_KNTT_B11",
    "folder": "lesson_11",
    "title": "Phong trào công nhân từ cuối thế kỉ XVIII đến đầu thế kỉ XX và sự ra đời của chủ nghĩa xã hội khoa học"
  },
  "keywords": [
    "Phong trào công nhân từ cuối thế kỉ XVIII đến đầu thế kỉ XX và sự ra đời của chủ nghĩa xã hội khoa học",
    "Phong",
    "trào",
    "công",
    "cuối",
    "XIX",
    "đầu",
    "gắn",
    "đời",
    "ngày",
    "Quốc",
    "Lao"
  ],
  "source": {
    "name": "SGK Lịch sử và Địa lí 8 - Kết nối tri thức với cuộc sống (Phần Lịch sử)",
    "url": "https://hanhtrangso.nxbgd.vn/",
    "locator": "Bài 11: Phong trào công nhân từ cuối thế kỉ XVIII đến đầu thế kỉ XX và sự ra đời của chủ nghĩa xã hội khoa học",
    "page_number": null
  },
  "review_status": "Đã kiểm tra cấu trúc và đối chiếu sơ bộ; chờ giáo viên duyệt",
  "provenance_note": "Câu trả lời được diễn đạt lại, tổng hợp theo bài học; không phải trích dẫn nguyên văn SGK.",
  "paired_question_file": "question_010.txt"
}
