{
  "dataset_name": "HISEDU - Lịch sử 8 Kết nối tri thức - Hỏi đáp RAG",
  "version": "1.0.0",
  "id": "Q_HIST8_LS_04_CAU_HOI_CB_02",
  "chunk_id": "CHK_HIST8_LS_04_CAU_HOI_CB_02",
  "title": "cac-to-chuc-doc-quyen-doi-hoan-canh-nao-va-tac-dong-nhu-the-nao-den",
  "question": "Các tổ chức độc quyền ra đời trong hoàn cảnh nào và tác động như thế nào đến nền kinh tế?",
  "answer": "Khi sản xuất quy mô lớn cần vốn khổng lồ và cạnh tranh gay gắt, các doanh nghiệp liên kết hoặc thôn tính nhau thành cartel, syndicate, trust. Chúng chi phối giá, thị trường và chính sách nhà nước, làm cạnh tranh tự do chuyển dần sang độc quyền.",
  "answer_type": "textbook_factual",
  "difficulty": "basic",
  "chapter": {
    "id": "HIST8_KNTT_CH04",
    "folder": "chapter_04",
    "title": "Châu Âu và nước Mỹ từ cuối thế kỉ XVIII đến đầu thế kỉ XX"
  },
  "lesson": {
    "id": "HIST8_KNTT_B10",
    "folder": "lesson_10",
    "title": "Sự hình thành chủ nghĩa đế quốc ở các nước Âu - Mỹ (cuối thế kỉ XIX - đầu thế kỉ XX)"
  },
  "keywords": [
    "Sự hình thành chủ nghĩa đế quốc ở các nước Âu - Mỹ (cuối thế kỉ XIX - đầu thế kỉ XX)",
    "chức",
    "độc",
    "quyền",
    "đời",
    "hoàn",
    "cảnh",
    "tác",
    "động",
    "nền",
    "kinh"
  ],
  "source": {
    "name": "SGK Lịch sử và Địa lí 8 - Kết nối tri thức với cuộc sống (Phần Lịch sử)",
    "url": "https://hanhtrangso.nxbgd.vn/",
    "locator": "Bài 10: Sự hình thành chủ nghĩa đế quốc ở các nước Âu - Mỹ (cuối thế kỉ XIX - đầu thế kỉ XX)",
    "page_number": null
  },
  "review_status": "Đã kiểm tra cấu trúc và đối chiếu sơ bộ; chờ giáo viên duyệt",
  "provenance_note": "Câu trả lời được diễn đạt lại, tổng hợp theo bài học; không phải trích dẫn nguyên văn SGK.",
  "paired_question_file": "question_002.txt"
}
