{
  "dataset_name": "HISEDU - Lịch sử 8 Kết nối tri thức - Hỏi đáp RAG",
  "version": "1.0.0",
  "id": "Q_HIST8_CHUONG_1_20_CAU_CB_03",
  "chunk_id": "CHK_HIST8_CHUONG_1_20_CAU_CB_03",
  "title": "vi-sao-che-do-phong-kien-anh-tro-thanh-tro-ngai-doi-voi-su-phat-trien",
  "question": "Vì sao chế độ phong kiến Anh trở thành trở ngại đối với sự phát triển kinh tế?",
  "answer": "Chế độ quân chủ chuyên chế duy trì đặc quyền phong kiến, thuế khóa và độc quyền, cản trở kinh doanh, thương mại và quan hệ sản xuất tư bản chủ nghĩa đang phát triển.",
  "answer_type": "textbook_factual",
  "difficulty": "basic",
  "chapter": {
    "id": "HIST8_KNTT_CH01",
    "folder": "chapter_01",
    "title": "Châu Âu và Bắc Mỹ từ nửa sau thế kỉ XVI đến thế kỉ XVIII"
  },
  "lesson": {
    "id": "HIST8_KNTT_B01",
    "folder": "lesson_01",
    "title": "Cách mạng tư sản Anh và chiến tranh giành độc lập của 13 thuộc địa Anh ở Bắc Mỹ"
  },
  "keywords": [
    "Cách mạng tư sản Anh và chiến tranh giành độc lập của 13 thuộc địa Anh ở Bắc Mỹ",
    "sao",
    "chế",
    "phong",
    "kiến",
    "Anh",
    "trở",
    "thành",
    "ngại",
    "phát",
    "triển",
    "kinh"
  ],
  "source": {
    "name": "SGK Lịch sử và Địa lí 8 - Kết nối tri thức với cuộc sống (Phần Lịch sử)",
    "url": "https://hanhtrangso.nxbgd.vn/",
    "locator": "Bài 1: Cách mạng tư sản Anh và chiến tranh giành độc lập của 13 thuộc địa Anh ở Bắc Mỹ",
    "page_number": null
  },
  "review_status": "Đã kiểm tra cấu trúc và đối chiếu sơ bộ; chờ giáo viên duyệt",
  "provenance_note": "Câu trả lời được diễn đạt lại, tổng hợp theo bài học; không phải trích dẫn nguyên văn SGK.",
  "paired_question_file": "question_003.txt"
}
