{
  "dataset_name": "HISEDU - Lịch sử 8 Kết nối tri thức - Hỏi đáp RAG",
  "version": "1.0.0",
  "id": "Q_HIST8_CHUONG_2_20_CAU_CB_13",
  "chunk_id": "CHK_HIST8_CHUONG_2_20_CAU_CB_13",
  "title": "van-hoa-phuong-tay-duoc-truyen-ba-vao-dong-nam-a-nhung-con-duong-nao",
  "question": "Văn hóa phương Tây được truyền bá vào Đông Nam Á theo những con đường nào?",
  "answer": "Văn hóa phương Tây được truyền bá qua hoạt động truyền giáo, trường học, báo chí, thương mại và bộ máy hành chính thuộc địa.",
  "answer_type": "textbook_factual",
  "difficulty": "basic",
  "chapter": {
    "id": "HIST8_KNTT_CH02",
    "folder": "chapter_02",
    "title": "Đông Nam Á từ nửa sau thế kỉ XVI đến giữa thế kỉ XIX"
  },
  "lesson": {
    "id": "HIST8_KNTT_B04",
    "folder": "lesson_04",
    "title": "Đông Nam Á từ nửa sau thế kỉ XVI đến giữa thế kỉ XIX"
  },
  "keywords": [
    "Đông Nam Á từ nửa sau thế kỉ XVI đến giữa thế kỉ XIX",
    "Văn",
    "hóa",
    "phương",
    "Tây",
    "truyền",
    "Đông",
    "Nam",
    "con",
    "đường"
  ],
  "source": {
    "name": "SGK Lịch sử và Địa lí 8 - Kết nối tri thức với cuộc sống (Phần Lịch sử)",
    "url": "https://hanhtrangso.nxbgd.vn/",
    "locator": "Bài 4: Đông Nam Á từ nửa sau thế kỉ XVI đến giữa thế kỉ XIX",
    "page_number": null
  },
  "review_status": "Đã kiểm tra cấu trúc và đối chiếu sơ bộ; chờ giáo viên duyệt",
  "provenance_note": "Câu trả lời được diễn đạt lại, tổng hợp theo bài học; không phải trích dẫn nguyên văn SGK.",
  "paired_question_file": "question_013.txt"
}
