{
  "dataset_name": "HISEDU - Lịch sử 8 Kết nối tri thức - Hỏi đáp RAG",
  "version": "1.0.0",
  "id": "Q_HIST8_CHUONG_3_20_CAU_CB_14",
  "chunk_id": "CHK_HIST8_CHUONG_3_20_CAU_CB_14",
  "title": "hoi-an-va-thanh-ha-co-vai-tro-gi-doi-voi-hoat-dong-thuong-mai",
  "question": "Hội An và Thanh Hà có vai trò gì đối với hoạt động thương mại?",
  "answer": "Hội An và Thanh Hà là các thương cảng quan trọng của Đàng Trong, nơi hàng hóa trong nước tập trung và thương nhân Nhật Bản, Trung Quốc, châu Âu đến giao dịch.",
  "answer_type": "textbook_factual",
  "difficulty": "basic",
  "chapter": {
    "id": "HIST8_KNTT_CH03",
    "folder": "chapter_03",
    "title": "Việt Nam từ đầu thế kỉ XVI đến thế kỉ XVIII"
  },
  "lesson": {
    "id": "HIST8_KNTT_B06",
    "folder": "lesson_06",
    "title": "Công cuộc khai phá vùng đất phía Nam từ thế kỉ XVI đến thế kỉ XVIII"
  },
  "keywords": [
    "Công cuộc khai phá vùng đất phía Nam từ thế kỉ XVI đến thế kỉ XVIII",
    "Hội",
    "Thanh",
    "vai",
    "trò",
    "hoạt",
    "động",
    "thương",
    "mại"
  ],
  "source": {
    "name": "SGK Lịch sử và Địa lí 8 - Kết nối tri thức với cuộc sống (Phần Lịch sử)",
    "url": "https://hanhtrangso.nxbgd.vn/",
    "locator": "Bài 6: Công cuộc khai phá vùng đất phía Nam từ thế kỉ XVI đến thế kỉ XVIII",
    "page_number": null
  },
  "review_status": "Đã kiểm tra cấu trúc và đối chiếu sơ bộ; chờ giáo viên duyệt",
  "provenance_note": "Câu trả lời được diễn đạt lại, tổng hợp theo bài học; không phải trích dẫn nguyên văn SGK.",
  "paired_question_file": "question_004.txt"
}
