{
  "dataset_name": "HISEDU - Lịch sử 8 Kết nối tri thức - Hỏi đáp RAG",
  "version": "1.0.0",
  "id": "Q_HIST8_LS_02_CAU_HOI_CB_17",
  "chunk_id": "CHK_HIST8_LS_02_CAU_HOI_CB_17",
  "title": "chinh-quyen-thuc-dan-to-chuc-bo-may-cai-tri-tai-cac-thuoc-dia-dong-nam",
  "question": "Chính quyền thực dân tổ chức bộ máy cai trị tại các thuộc địa Đông Nam Á như thế nào?",
  "answer": "Thực dân đặt toàn quyền hoặc thống đốc ở cấp cao, duy trì một phần vua quan bản xứ để cai trị gián tiếp ở nơi cần thiết, chia lại hành chính và dùng quân đội, cảnh sát, luật thuộc địa để kiểm soát.",
  "answer_type": "textbook_factual",
  "difficulty": "basic",
  "chapter": {
    "id": "HIST8_KNTT_CH02",
    "folder": "chapter_02",
    "title": "Đông Nam Á từ nửa sau thế kỉ XVI đến thế kỉ XIX"
  },
  "lesson": {
    "id": "HIST8_KNTT_B04",
    "folder": "lesson_04",
    "title": "Đông Nam Á từ nửa sau thế kỉ XVI đến giữa thế kỉ XIX"
  },
  "keywords": [
    "Đông Nam Á từ nửa sau thế kỉ XVI đến giữa thế kỉ XIX",
    "Chính",
    "quyền",
    "thực",
    "chức",
    "máy",
    "cai",
    "trị",
    "tại",
    "thuộc",
    "địa",
    "Đông"
  ],
  "source": {
    "name": "SGK Lịch sử và Địa lí 8 - Kết nối tri thức với cuộc sống (Phần Lịch sử)",
    "url": "https://hanhtrangso.nxbgd.vn/",
    "locator": "Bài 4: Đông Nam Á từ nửa sau thế kỉ XVI đến giữa thế kỉ XIX",
    "page_number": null
  },
  "review_status": "Đã kiểm tra cấu trúc và đối chiếu sơ bộ; chờ giáo viên duyệt",
  "provenance_note": "Câu trả lời được diễn đạt lại, tổng hợp theo bài học; không phải trích dẫn nguyên văn SGK.",
  "paired_question_file": "question_042.txt"
}
