{
  "dataset_name": "HISEDU - Lịch sử 8 Kết nối tri thức - Hỏi đáp RAG",
  "version": "1.0.0",
  "id": "Q_HIST8_LS_02_CAU_HOI_CB_03",
  "chunk_id": "CHK_HIST8_LS_02_CAU_HOI_CB_03",
  "title": "cac-quoc-gia-phong-kien-dong-nam-a-co-nhung-kho-khan-gi-phuong-tay-bat",
  "question": "Các quốc gia phong kiến Đông Nam Á có những khó khăn gì khi phương Tây bắt đầu xâm nhập?",
  "answer": "Nhiều quốc gia suy yếu do tranh chấp ngôi vị, cát cứ và xung đột nội bộ; quân sự, tàu thuyền và kĩ thuật kém hơn phương Tây, trong khi thiếu một cơ chế phối hợp khu vực.",
  "answer_type": "textbook_factual",
  "difficulty": "basic",
  "chapter": {
    "id": "HIST8_KNTT_CH02",
    "folder": "chapter_02",
    "title": "Đông Nam Á từ nửa sau thế kỉ XVI đến thế kỉ XIX"
  },
  "lesson": {
    "id": "HIST8_KNTT_B04",
    "folder": "lesson_04",
    "title": "Đông Nam Á từ nửa sau thế kỉ XVI đến giữa thế kỉ XIX"
  },
  "keywords": [
    "Đông Nam Á từ nửa sau thế kỉ XVI đến giữa thế kỉ XIX",
    "quốc",
    "gia",
    "phong",
    "kiến",
    "Đông",
    "Nam",
    "khó",
    "khăn",
    "phương",
    "Tây",
    "bắt"
  ],
  "source": {
    "name": "SGK Lịch sử và Địa lí 8 - Kết nối tri thức với cuộc sống (Phần Lịch sử)",
    "url": "https://hanhtrangso.nxbgd.vn/",
    "locator": "Bài 4: Đông Nam Á từ nửa sau thế kỉ XVI đến giữa thế kỉ XIX",
    "page_number": null
  },
  "review_status": "Đã kiểm tra cấu trúc và đối chiếu sơ bộ; chờ giáo viên duyệt",
  "provenance_note": "Câu trả lời được diễn đạt lại, tổng hợp theo bài học; không phải trích dẫn nguyên văn SGK.",
  "paired_question_file": "question_028.txt"
}
