{
  "dataset_name": "HISEDU - Lịch sử 8 Kết nối tri thức - Hỏi đáp RAG",
  "version": "1.0.0",
  "id": "Q_HIST8_LS_02_CAU_HOI_CB_27",
  "chunk_id": "CHK_HIST8_LS_02_CAU_HOI_CB_27",
  "title": "nhan-dan-phi-lip-pin-da-the-hien-tinh-than-chong-ach-thong-tri-tay-ban",
  "question": "Nhân dân Phi-líp-pin đã thể hiện tinh thần chống ách thống trị Tây Ban Nha như thế nào?",
  "answer": "Người Phi-líp-pin liên tục tiến hành các cuộc nổi dậy địa phương, chống sưu thuế, lao dịch và ép buộc tôn giáo; dù phân tán, các phong trào duy trì ý thức tự chủ và truyền thống chống Tây Ban Nha.",
  "answer_type": "textbook_factual",
  "difficulty": "basic",
  "chapter": {
    "id": "HIST8_KNTT_CH02",
    "folder": "chapter_02",
    "title": "Đông Nam Á từ nửa sau thế kỉ XVI đến thế kỉ XIX"
  },
  "lesson": {
    "id": "HIST8_KNTT_B04",
    "folder": "lesson_04",
    "title": "Đông Nam Á từ nửa sau thế kỉ XVI đến giữa thế kỉ XIX"
  },
  "keywords": [
    "Đông Nam Á từ nửa sau thế kỉ XVI đến giữa thế kỉ XIX",
    "Phi-líp-pin",
    "thể",
    "tinh",
    "thần",
    "chống",
    "ách",
    "thống",
    "trị",
    "Tây",
    "Ban",
    "Nha"
  ],
  "source": {
    "name": "SGK Lịch sử và Địa lí 8 - Kết nối tri thức với cuộc sống (Phần Lịch sử)",
    "url": "https://hanhtrangso.nxbgd.vn/",
    "locator": "Bài 4: Đông Nam Á từ nửa sau thế kỉ XVI đến giữa thế kỉ XIX",
    "page_number": null
  },
  "review_status": "Đã kiểm tra cấu trúc và đối chiếu sơ bộ; chờ giáo viên duyệt",
  "provenance_note": "Câu trả lời được diễn đạt lại, tổng hợp theo bài học; không phải trích dẫn nguyên văn SGK.",
  "paired_question_file": "question_052.txt"
}
