{
  "dataset_name": "HISEDU - Lịch sử 8 Kết nối tri thức - Hỏi đáp RAG",
  "version": "1.0.0",
  "id": "Q_HIST8_LS_07_CAU_HOI_CB_20",
  "chunk_id": "CHK_HIST8_LS_07_CAU_HOI_CB_20",
  "title": "phong-trao-chong-phap-cuoi-the-ki-xix-co-nhung-nguyen-nhan-that-bai-va-y",
  "question": "Phong trào chống Pháp cuối thế kỉ XIX có những nguyên nhân thất bại và ý nghĩa lịch sử gì?",
  "answer": "Các phong trào thất bại vì vũ khí, tổ chức và đường lối phong kiến hạn chế, hoạt động phân tán, thiếu liên kết toàn quốc, trong khi Pháp mạnh và đã củng cố cai trị. Chúng vẫn thể hiện lòng yêu nước, gây tổn thất cho Pháp và để lại kinh nghiệm đấu tranh.",
  "answer_type": "textbook_factual",
  "difficulty": "basic",
  "chapter": {
    "id": "HIST8_KNTT_CH07",
    "folder": "chapter_07",
    "title": "Việt Nam từ thế kỉ XIX đến đầu thế kỉ XX"
  },
  "lesson": {
    "id": "HIST8_KNTT_B18",
    "folder": "lesson_18",
    "title": "Phong trào chống Pháp trong những năm 1885 - 1896"
  },
  "keywords": [
    "Phong trào chống Pháp trong những năm 1885 - 1896",
    "Phong",
    "trào",
    "chống",
    "Pháp",
    "cuối",
    "XIX",
    "nguyên",
    "thất",
    "bại",
    "nghĩa",
    "lịch"
  ],
  "source": {
    "name": "SGK Lịch sử và Địa lí 8 - Kết nối tri thức với cuộc sống (Phần Lịch sử)",
    "url": "https://hanhtrangso.nxbgd.vn/",
    "locator": "Bài 18: Phong trào chống Pháp trong những năm 1885 - 1896",
    "page_number": null
  },
  "review_status": "Đã kiểm tra cấu trúc và đối chiếu sơ bộ; chờ giáo viên duyệt",
  "provenance_note": "Câu trả lời được diễn đạt lại, tổng hợp theo bài học; không phải trích dẫn nguyên văn SGK.",
  "paired_question_file": "question_006.txt"
}
