{
  "dataset_name": "HISEDU - Lịch sử 8 Kết nối tri thức - Hỏi đáp RAG",
  "version": "1.0.0",
  "id": "Q_HIST8_LS_07_CAU_HOI_CB_29",
  "chunk_id": "CHK_HIST8_LS_07_CAU_HOI_CB_29",
  "title": "nhung-phong-trao-yeu-nuoc-nao-tiep-tuc-dien-thoi-gian-chien-tranh-the-gioi-thu",
  "question": "Những phong trào yêu nước nào tiếp tục diễn ra trong thời gian Chiến tranh thế giới thứ nhất?",
  "answer": "Tiêu biểu có hoạt động của Việt Nam Quang phục hội, cuộc khởi nghĩa của Thái Phiên–Trần Cao Vân ở Trung Kì năm 1916, khởi nghĩa Thái Nguyên năm 1917 và các cuộc đấu tranh của công nhân, binh lính, đồng bào miền núi.",
  "answer_type": "textbook_factual",
  "difficulty": "basic",
  "chapter": {
    "id": "HIST8_KNTT_CH07",
    "folder": "chapter_07",
    "title": "Việt Nam từ thế kỉ XIX đến đầu thế kỉ XX"
  },
  "lesson": {
    "id": "HIST8_KNTT_B19",
    "folder": "lesson_19",
    "title": "Phong trào yêu nước chống Pháp ở Việt Nam từ đầu thế kỉ XX đến năm 1917"
  },
  "keywords": [
    "Phong trào yêu nước chống Pháp ở Việt Nam từ đầu thế kỉ XX đến năm 1917",
    "phong",
    "trào",
    "yêu",
    "tiếp",
    "tục",
    "diễn",
    "gian",
    "Chiến",
    "tranh",
    "giới",
    "thứ"
  ],
  "source": {
    "name": "SGK Lịch sử và Địa lí 8 - Kết nối tri thức với cuộc sống (Phần Lịch sử)",
    "url": "https://hanhtrangso.nxbgd.vn/",
    "locator": "Bài 19: Phong trào yêu nước chống Pháp ở Việt Nam từ đầu thế kỉ XX đến năm 1917",
    "page_number": null
  },
  "review_status": "Đã kiểm tra cấu trúc và đối chiếu sơ bộ; chờ giáo viên duyệt",
  "provenance_note": "Câu trả lời được diễn đạt lại, tổng hợp theo bài học; không phải trích dẫn nguyên văn SGK.",
  "paired_question_file": "question_005.txt"
}
